=== dmesg -T | grep "eth2" (on stor-node-05, last 30 min excerpt) ===
[Thu Mar  5 08:41:12 2026] ixgbe 0000:3b:00.0 eth2: NIC Link is Down
[Thu Mar  5 08:41:18 2026] ixgbe 0000:3b:00.0 eth2: NIC Link is Up 10 Gbps, Flow Control: RX/TX
[Thu Mar  5 08:47:33 2026] ixgbe 0000:3b:00.0 eth2: NIC Link is Down
[Thu Mar  5 08:47:40 2026] ixgbe 0000:3b:00.0 eth2: NIC Link is Up 10 Gbps, Flow Control: RX/TX
[Thu Mar  5 08:51:05 2026] ixgbe 0000:3b:00.0 eth2: NIC Link is Down
[Thu Mar  5 08:51:11 2026] ixgbe 0000:3b:00.0 eth2: NIC Link is Up 10 Gbps, Flow Control: RX/TX
[Thu Mar  5 08:58:44 2026] ixgbe 0000:3b:00.0 eth2: NIC Link is Down
[Thu Mar  5 08:58:50 2026] ixgbe 0000:3b:00.0 eth2: NIC Link is Up 10 Gbps, Flow Control: RX/TX

=== ethtool -m eth2 (SFP+ module diagnostics) ===
        Identifier                                : 0x03 (SFP)
        Connector                                 : 0x21 (Copper pigtail)
        Transceiver type                          : 10G Base-CR (DAC)
        Vendor name                               : ACME-CABLES
        Vendor PN                                 : DAC-10G-3M
        Vendor SN                                 : ACM2024110847
        Laser output power                        : -8.2041 dBm (0.1514 mW)  ** LOW ALARM **
        Receiver signal average optical power     : -9.1020 dBm (0.1230 mW)  ** LOW ALARM **
        Module temperature                        : 38.50 C
        Module voltage                            : 3.28 V
        Alarm/warning thresholds:
          Laser output power high alarm           : 3.0 dBm
          Laser output power low alarm            : -5.0 dBm
          Receiver signal power high alarm        : 3.0 dBm
          Receiver signal power low alarm         : -5.0 dBm

=== ethtool -S eth2 | grep -i "err\|crc" ===
     rx_crc_errors: 14822
     rx_errors: 14822
     tx_errors: 0
     rx_length_errors: 0
     rx_over_errors: 0
     rx_frame_errors: 0
